<!ELEMENT translation-status (release*, module*) >
<!ATTLIST translation-status
  xmlns CDATA #FIXED 'http://developer.gnome.org/projects/gtp/status/translation-status.dtd' >

<!ELEMENT release (group*) >
<!ATTLIST release name ID #REQUIRED >

<!ELEMENT group (description, essential?, frozen?) >
<!ATTLIST group name ID #REQUIRED >

<!ELEMENT description (#PCDATA) >
<!ELEMENT essential EMPTY >
<!ELEMENT frozen EMPTY >

<!ELEMENT module (version*) >
<!ATTLIST module name CDATA #REQUIRED >

<!ELEMENT version (component*) > 
<!ATTLIST version release IDREF #REQUIRED >

<!ELEMENT component (podir, potname, branch, regenerate?, download?, nextrelease?) >
<!ATTLIST component name CDATA #REQUIRED >
<!ATTLIST component dir CDATA #REQUIRED >
<!ATTLIST component group IDREF #REQUIRED >

<!ELEMENT podir EMPTY >
<!ATTLIST podir dir CDATA #REQUIRED >

<!ELEMENT potname EMPTY >
<!ATTLIST potname name CDATA #REQUIRED >

<!ELEMENT branch EMPTY >
<!ATTLIST branch name NMTOKEN #REQUIRED >

<!ELEMENT regenerate EMPTY >

<!ELEMENT download EMPTY >

<!ELEMENT nextrelease EMPTY >
<!ATTLIST nextrelease date CDATA #REQUIRED >
